{
  "candidates_version": "MOS-LIB-V0.5-CANDIDATES",
  "source": "MOS-Music-Library-V0.5_新增45首.csv（人工提供；本仓只保存规范形态，不补全、不猜写）",
  "received_at": "2026-09-21T08:10:15.424Z",
  "status": "RECEIVED",
  "expected_new": 45,
  "target_total": 50,
  "existing_total": 5,
  "columns": [
    "song_id",
    "title_zh",
    "title_en",
    "copyright_status",
    "notes"
  ],
  "candidates": [
    {
      "candidate_no": 1,
      "candidate_song_id": "S-0006",
      "title_zh": "圣哉，圣哉，圣哉",
      "title_en": "Holy, Holy, Holy! Lord God Almighty",
      "alternate_titles": [],
      "author": null,
      "composer": null,
      "translator": null,
      "source": null,
      "initial_theme": null,
      "suggested_function": null,
      "copyright_status": "SOURCE_REQUIRED",
      "candidate_note": "传统圣诗；具体中文译词/编曲需核"
    },
    {
      "candidate_no": 2,
      "candidate_song_id": "S-0007",
      "title_zh": "荣耀归于真神",
      "title_en": "To God Be the Glory",
      "alternate_titles": [],
      "author": null,
      "composer": null,
      "translator": null,
      "source": null,
      "initial_theme": null,
      "suggested_function": null,
      "copyright_status": "SOURCE_REQUIRED",
      "candidate_note": "传统圣诗；具体中文译词/编曲需核"
    },
    {
      "candidate_no": 3,
      "candidate_song_id": "S-0008",
      "title_zh": "拥戴我主为王",
      "title_en": "Crown Him with Many Crowns",
      "alternate_titles": [],
      "author": null,
      "composer": null,
      "translator": null,
      "source": null,
      "initial_theme": null,
      "suggested_function": null,
      "copyright_status": "SOURCE_REQUIRED",
      "candidate_note": "传统圣诗；具体中文译词/编曲需核"
    },
    {
      "candidate_no": 4,
      "candidate_song_id": "S-0009",
      "title_zh": "你真伟大",
      "title_en": "How Great Thou Art",
      "alternate_titles": [],
      "author": null,
      "composer": null,
      "translator": null,
      "source": null,
      "initial_theme": null,
      "suggested_function": null,
      "copyright_status": "SOURCE_REQUIRED",
      "candidate_note": "传统圣诗；具体中文译词/编曲需核"
    },
    {
      "candidate_no": 5,
      "candidate_song_id": "S-0010",
      "title_zh": "你的信实广大",
      "title_en": "Great Is Thy Faithfulness",
      "alternate_titles": [],
      "author": null,
      "composer": null,
      "translator": null,
      "source": null,
      "initial_theme": null,
      "suggested_function": null,
      "copyright_status": "SOURCE_REQUIRED",
      "candidate_note": "传统圣诗；具体中文译词/编曲需核"
    },
    {
      "candidate_no": 6,
      "candidate_song_id": "S-0011",
      "title_zh": "坚固保障",
      "title_en": "A Mighty Fortress Is Our God",
      "alternate_titles": [],
      "author": null,
      "composer": null,
      "translator": null,
      "source": null,
      "initial_theme": null,
      "suggested_function": null,
      "copyright_status": "SOURCE_REQUIRED",
      "candidate_note": "传统圣诗；具体中文译词/编曲需核"
    },
    {
      "candidate_no": 7,
      "candidate_song_id": "S-0012",
      "title_zh": "十字架前",
      "title_en": "At the Cross",
      "alternate_titles": [],
      "author": null,
      "composer": null,
      "translator": null,
      "source": null,
      "initial_theme": null,
      "suggested_function": null,
      "copyright_status": "SOURCE_REQUIRED",
      "candidate_note": "传统圣诗；不同中文版本名称可能不同"
    },
    {
      "candidate_no": 8,
      "candidate_song_id": "S-0013",
      "title_zh": "古旧十架",
      "title_en": "The Old Rugged Cross",
      "alternate_titles": [],
      "author": null,
      "composer": null,
      "translator": null,
      "source": null,
      "initial_theme": null,
      "suggested_function": null,
      "copyright_status": "SOURCE_REQUIRED",
      "candidate_note": "传统圣诗；具体中文译词/编曲需核"
    },
    {
      "candidate_no": 9,
      "candidate_song_id": "S-0014",
      "title_zh": "耶稣十字架下",
      "title_en": "Beneath the Cross of Jesus",
      "alternate_titles": [],
      "author": null,
      "composer": null,
      "translator": null,
      "source": null,
      "initial_theme": null,
      "suggested_function": null,
      "copyright_status": "SOURCE_REQUIRED",
      "candidate_note": "传统圣诗；具体中文译词/编曲需核"
    },
    {
      "candidate_no": 10,
      "candidate_song_id": "S-0015",
      "title_zh": "奇妙十架",
      "title_en": "When I Survey the Wondrous Cross",
      "alternate_titles": [],
      "author": null,
      "composer": null,
      "translator": null,
      "source": null,
      "initial_theme": null,
      "suggested_function": null,
      "copyright_status": "SOURCE_REQUIRED",
      "candidate_note": "传统圣诗；具体中文译词/编曲需核"
    },
    {
      "candidate_no": 11,
      "candidate_song_id": "S-0016",
      "title_zh": "领我到骷髅地",
      "title_en": "Lead Me to Calvary",
      "alternate_titles": [],
      "author": null,
      "composer": null,
      "translator": null,
      "source": null,
      "initial_theme": null,
      "suggested_function": null,
      "copyright_status": "SOURCE_REQUIRED",
      "candidate_note": "传统圣诗；具体中文译词/编曲需核"
    },
    {
      "candidate_no": 12,
      "candidate_song_id": "S-0017",
      "title_zh": "宝血活泉",
      "title_en": "There Is a Fountain Filled with Blood",
      "alternate_titles": [],
      "author": null,
      "composer": null,
      "translator": null,
      "source": null,
      "initial_theme": null,
      "suggested_function": null,
      "copyright_status": "SOURCE_REQUIRED",
      "candidate_note": "传统圣诗；具体中文译词/编曲需核"
    },
    {
      "candidate_no": 13,
      "candidate_song_id": "S-0018",
      "title_zh": "耶稣奇妙的救恩",
      "title_en": "Wonderful Grace of Jesus",
      "alternate_titles": [],
      "author": null,
      "composer": null,
      "translator": null,
      "source": null,
      "initial_theme": null,
      "suggested_function": null,
      "copyright_status": "SOURCE_REQUIRED",
      "candidate_note": "传统圣诗；具体中文译词/编曲需核"
    },
    {
      "candidate_no": 14,
      "candidate_song_id": "S-0019",
      "title_zh": "主活着",
      "title_en": "He Lives",
      "alternate_titles": [],
      "author": null,
      "composer": null,
      "translator": null,
      "source": null,
      "initial_theme": null,
      "suggested_function": null,
      "copyright_status": "SOURCE_REQUIRED",
      "candidate_note": "传统圣诗；具体中文译词/编曲需核"
    },
    {
      "candidate_no": 15,
      "candidate_song_id": "S-0020",
      "title_zh": "基督今复活",
      "title_en": "Christ the Lord Is Risen Today",
      "alternate_titles": [],
      "author": null,
      "composer": null,
      "translator": null,
      "source": null,
      "initial_theme": null,
      "suggested_function": null,
      "copyright_status": "SOURCE_REQUIRED",
      "candidate_note": "传统圣诗；具体中文译词/编曲需核"
    },
    {
      "candidate_no": 16,
      "candidate_song_id": "S-0021",
      "title_zh": "转眼仰望耶稣",
      "title_en": "Turn Your Eyes upon Jesus",
      "alternate_titles": [],
      "author": null,
      "composer": null,
      "translator": null,
      "source": null,
      "initial_theme": null,
      "suggested_function": null,
      "copyright_status": "SOURCE_REQUIRED",
      "candidate_note": "传统圣诗；具体中文译词/编曲需核"
    },
    {
      "candidate_no": 17,
      "candidate_song_id": "S-0022",
      "title_zh": "最美丽耶稣",
      "title_en": "Fairest Lord Jesus",
      "alternate_titles": [],
      "author": null,
      "composer": null,
      "translator": null,
      "source": null,
      "initial_theme": null,
      "suggested_function": null,
      "copyright_status": "SOURCE_REQUIRED",
      "candidate_note": "传统圣诗；不同中文版本名称可能不同"
    },
    {
      "candidate_no": 18,
      "candidate_song_id": "S-0023",
      "title_zh": "恳求主像牧人领导",
      "title_en": "Savior, Like a Shepherd Lead Us",
      "alternate_titles": [],
      "author": null,
      "composer": null,
      "translator": null,
      "source": null,
      "initial_theme": null,
      "suggested_function": null,
      "copyright_status": "SOURCE_REQUIRED",
      "candidate_note": "传统圣诗；具体中文译词/编曲需核"
    },
    {
      "candidate_no": 19,
      "candidate_song_id": "S-0024",
      "title_zh": "主凡事引导我",
      "title_en": "All the Way My Savior Leads Me",
      "alternate_titles": [],
      "author": null,
      "composer": null,
      "translator": null,
      "source": null,
      "initial_theme": null,
      "suggested_function": null,
      "copyright_status": "SOURCE_REQUIRED",
      "candidate_note": "传统圣诗；具体中文译词/编曲需核"
    },
    {
      "candidate_no": 20,
      "candidate_song_id": "S-0025",
      "title_zh": "耶稣领我",
      "title_en": "He Leadeth Me",
      "alternate_titles": [],
      "author": null,
      "composer": null,
      "translator": null,
      "source": null,
      "initial_theme": null,
      "suggested_function": null,
      "copyright_status": "SOURCE_REQUIRED",
      "candidate_note": "传统圣诗；具体中文译词/编曲需核"
    },
    {
      "candidate_no": 21,
      "candidate_song_id": "S-0026",
      "title_zh": "向高处行",
      "title_en": "Higher Ground",
      "alternate_titles": [],
      "author": null,
      "composer": null,
      "translator": null,
      "source": null,
      "initial_theme": null,
      "suggested_function": null,
      "copyright_status": "SOURCE_REQUIRED",
      "candidate_note": "传统圣诗；具体中文译词/编曲需核"
    },
    {
      "candidate_no": 22,
      "candidate_song_id": "S-0027",
      "title_zh": "更亲近我主",
      "title_en": "Nearer, Still Nearer",
      "alternate_titles": [],
      "author": null,
      "composer": null,
      "translator": null,
      "source": null,
      "initial_theme": null,
      "suggested_function": null,
      "copyright_status": "SOURCE_REQUIRED",
      "candidate_note": "传统圣诗；具体中文译词/编曲需核"
    },
    {
      "candidate_no": 23,
      "candidate_song_id": "S-0028",
      "title_zh": "更像我恩主",
      "title_en": "More Like the Master",
      "alternate_titles": [],
      "author": null,
      "composer": null,
      "translator": null,
      "source": null,
      "initial_theme": null,